variant,model,query_id,run_idx,question,answer,latency_s,input_tokens,output_tokens,cost_usd,n_retrievals,n_tool_calls,error,faithfulness,completeness,correctness,conciseness,overall,judge_notes,reference_answer,difficulty,hop_count
workflow,anthropic/claude-opus-4.7,,0,"What does the AI Office Hours post on tool-selection evaluation say about positional bias, and how does that connect to the broader idea of supervised learning evaluation as discussed on Wikipedia?","# Positional Bias in Tool Selection and Its Connection to Supervised Learning Evaluation

## What the AI Office Hours Post Says About Positional Bias

The post ""Evaluating AI Agent Tool Selection"" describes **positional bias** as the LLM's ""tendency to pay more attention to tokens at the start or end of the prompt while glossing over tokens in the middle"" — a phenomenon also known as the ""lost-in-the-middle"" problem [beehiiv: Evaluating AI Agent Tool Selection]. In the context of AI agents, this matters because tools listed later in the prompt often end up in the middle of the overall context, causing the LLM to favor tools recorded earlier and potentially pick the wrong one [beehiiv: Evaluating AI Agent Tool Selection].

The author's experiment quantified this effect: across five tool positions, LLMs on average chose the first tool roughly 9.51% more often than it was actually the correct choice, while later tools were under-selected [beehiiv: Evaluating AI Agent Tool Selection]. Critically, this bias was **not** limited to smaller open-source models — even ""gold standard"" OpenAI models exhibited it — and the author attributes the issue to the underlying Transformer architecture itself [beehiiv: Evaluating AI Agent Tool Selection].

The key takeaway from the post: evaluating agents cannot stop at checking whether the final answer is correct. Tool selection needs to be **measured** directly, because an agent can arrive at the right answer despite inefficient or biased intermediate tool choices that hurt accuracy, latency, and consistency [beehiiv: Evaluating AI Agent Tool Selection].

## Connection to Supervised Learning Evaluation on Wikipedia

Supervised learning, per Wikipedia, ""uses a set of paired inputs and desired outputs,"" and the learning task is ""to produce the desired output for each input,"" with cost functions (e.g., mean-squared error) designed around ""eliminating incorrect deductions"" [wikipedia: Neural network (machine learning)]. Evaluation in machine learning is generally framed around ""the ability to reproduce known knowledge"" — i.e., comparing model outputs against labeled ground truth [wikipedia: Machine learning].

The tool-selection evaluation described in the beehiiv post fits this supervised-learning evaluation paradigm closely: the author has a labeled set where each query has a known ""correct tool index,"" and measures how often the LLM's chosen tool matches that label — essentially treating tool selection as a **classification task**, which Wikipedia lists as a canonical supervised learning task (""pattern recognition (also known as classification)"") [wikipedia: Neural network (machine learning)]. The 9.51% over-selection figure is a deviation from ground-truth labels, analogous to measuring classification error against known correct outputs [beehiiv: Evaluating AI Agent Tool Selection].

The connection also extends to the broader concern about **bias in ML evaluation**. Wikipedia notes that reducing bias in machine learning is an increasingly important concern for fairness and responsible use [wikipedia: Machine learning]. The beehiiv post illustrates a concrete, architectural form of bias (positional) that a naive end-to-end accuracy metric would miss — reinforcing the Wikipedia-level point that how you evaluate matters as much as whether the final output looks right.

## Caveats

The evidence provided does not include a Wikipedia passage that directly discusses positional bias or ""lost-in-the-middle"" effects in Transformers, so the link between the beehiiv post's specific bias mechanism and Wikipedia's treatment of supervised learning is **my synthesis** based on the general evaluation framing (labeled inputs/outputs, classification, fairness) in the Wikipedia excerpts [wikipedia: Neural network (machine learning)] [wikipedia: Machine learning], not a direct statement from Wikipedia about positional bias itself.",101.59260678291321,0,0,0.0,4,0,,5.0,4.0,4.0,3.0,3.9,"The answer accurately captures the beehiiv post's description of positional bias (lost-in-the-middle, tools earlier in the prompt favored, 9.51% over-selection, even OpenAI models affected) with direct grounding in the evidence. The connection to supervised learning evaluation is reasonable and uses Wikipedia evidence about classification and labeled outputs, and the candidate transparently flags that the Wikipedia evidence doesn't directly discuss positional bias — which is honest and faithful. The reference also mentions held-out test sets and robustness to spurious correlations, which the candidate doesn't explicitly cover (minor completeness gap). The answer is somewhat long with headers and repetition, costing conciseness points, but all claims are well-supported by evidence.","The Beehiiv post argues that LLM agents are biased toward tools listed earlier in the prompt, so accuracy on tool-selection benchmarks is sensitive to ordering. Wikipedia's articles on machine learning and information retrieval describe how supervised evaluation depends on a held-out test set and on metrics that are robust to spurious correlations; positional bias is exactly such a spurious correlation.",hard,2
workflow,anthropic/claude-opus-4.7,,0,"What does the AI Office Hours post on tool-selection evaluation say about positional bias, and how does that connect to the broader idea of supervised learning evaluation as discussed on Wikipedia?","# Positional Bias in Tool Selection and Its Connection to Supervised Learning Evaluation

## What the AI Office Hours Post Says About Positional Bias

The AI Office Hours post ""Evaluating AI Agent Tool Selection"" describes positional bias as the LLM's ""tendency to pay more attention to tokens at the start or end of the prompt while glossing over tokens in the middle,"" a phenomenon also known as the ""lost-in-the-middle"" problem [beehiiv: Evaluating AI Agent Tool Selection]. In the context of AI agents, this matters because tools listed later in the agent's prompt can end up buried in the middle of the overall context, causing the LLM to favor tools recorded earlier and potentially pick the wrong one [beehiiv: Evaluating AI Agent Tool Selection].

The post frames this as an architectural issue tied to the Transformer itself: ""there are underlying issues with the deep learning architecture that virtually every LLM is based on, the Transformer... there's one particular type of bias it falls prey to quite often, the positional bias"" [beehiiv: Evaluating AI Agent Tool Selection].

Empirically, the author ran a test with 5 tools and measured the gap between how often the agent chose a tool at each index versus how often that index was actually correct. Earlier-indexed tools were over-selected (e.g., +9.51% for the first position) and later tools were under-chosen — and critically, even ""gold standard"" OpenAI models fell victim to this bias [beehiiv: Evaluating AI Agent Tool Selection].

The key evaluation takeaway: ""evaluating an agent's performance goes beyond simply checking the final answer and how long it took to get there"" — a correct final output can still mask flawed, biased intermediate decisions [beehiiv: Evaluating AI Agent Tool Selection]. ""Don't assume a strong final output implies flawless tool selection"" [beehiiv: Evaluating AI Agent Tool Selection].

## Connection to Supervised Learning Evaluation (Wikipedia)

Supervised learning trains a model on paired inputs and desired outputs, then evaluates how well the learned function predicts outputs for new, unseen inputs [wikipedia: Machine learning]. Formal model assessment uses techniques like the holdout method (splitting data into training and test sets), K-fold cross-validation, and bootstrap sampling to estimate accuracy [wikipedia: Machine learning]. The guiding idea is that you don't trust a model based on a few outputs — you probe it systematically against known ground truth.

The AI Office Hours experiment mirrors this logic applied to agent tool selection: the author constructs a labeled test set (queries with known correct tools), measures the frequency of correct vs. chosen tool indices, and aggregates error rates across models — essentially a holdout-style accuracy evaluation, but at the tool-selection step rather than the final answer [beehiiv: Evaluating AI Agent Tool Selection]. This parallels Wikipedia's point that classifiers ""can be fine-tuned based on chosen examples using supervised learning"" and that each observation is compared against a predefined label [wikipedia: Artificial intelligence].

There is also a broader thematic link around **bias in evaluation**:

- Wikipedia notes that ""Machine learning applications can be biased if they learn from biased data,"" and that developers may not even be aware the bias exists, making fairness-focused evaluation necessary [wikipedia: Artificial intelligence].
- More specifically, Wikipedia's entry on large language models describes **selection bias**: an ""inherent tendency of large language models to favor certain option identifiers irrespective of the actual content of the options,"" such that ""when the ordering of options is altered... the model's performance can fluctuate significantly"" [wikipedia: Large language model]. This is conceptually very close to the positional bias the AI Office Hours post demonstrates — reordering the tools changes which one gets picked, independent of which is actually correct.
- Wikipedia's discussion of GPT evaluation likewise emphasizes that modern benchmarking goes beyond raw accuracy to include ""robustness, bias, and toxicity"" and features like fairness and transparency [wikipedia: Generative pre-trained transformer].

## Putting It Together

The AI Office Hours post is essentially applying the supervised-learning evaluation mindset — labeled test data, systematic accuracy measurement, and guarding against overfitting to a single metric — to a new target: the agent's internal tool-choice step [beehiiv: Evaluating AI Agent Tool Selection] [wikipedia: Machine learning]. Its finding that position in the prompt skews selection is a concrete instance of the more general selection/ordering bias documented for LLMs on Wikipedia [wikipedia: Large language model], and it reinforces the general ML lesson that evaluation must probe for bias rather than only check end-to-end correctness [wikipedia: Artificial intelligence] [wikipedia: Generative pre-trained transformer].

**Unsupported / not in evidence:** The provided evidence does not explicitly label the AI Office Hours test as ""supervised learning"" or connect it to specific techniques like K-fold cross-validation; that connection is an inference from the parallel methodologies rather than a direct claim in either source.",112.33692479133606,0,0,0.0,4,0,,5.0,5.0,5.0,3.0,4.6,"The answer faithfully grounds every major claim in the evidence, using direct quotes and proper citations. It fully covers the reference's points about positional bias favoring earlier-listed tools and connects to supervised learning evaluation via holdout/test set methodology and bias-robust metrics. It even adds useful related evidence (LLM selection bias, GPT benchmarking) and honestly flags inferential leaps. The main weakness is length — the answer is somewhat padded with headers and restatements, hurting conciseness, but correctness and faithfulness are excellent.","The Beehiiv post argues that LLM agents are biased toward tools listed earlier in the prompt, so accuracy on tool-selection benchmarks is sensitive to ordering. Wikipedia's articles on machine learning and information retrieval describe how supervised evaluation depends on a held-out test set and on metrics that are robust to spurious correlations; positional bias is exactly such a spurious correlation.",hard,2
workflow,anthropic/claude-opus-4.7,,0,"What does the AI Office Hours post on tool-selection evaluation say about positional bias, and how does that connect to the broader idea of supervised learning evaluation as discussed on Wikipedia?","# Positional Bias in Tool Selection and Its Connection to Supervised Learning Evaluation

## What the AI Office Hours Post Says About Positional Bias

The AI Office Hours post ""Evaluating AI Agent Tool Selection"" defines **positional bias** as the LLM's ""tendency to pay more attention to tokens at the start or end of the prompt while glossing over tokens in the middle"" — a phenomenon also known as the ""lost-in-the-middle"" problem [beehiiv: Evaluating AI Agent Tool Selection]. The post argues this is a structural issue tied to the Transformer architecture that ""virtually every LLM is based on"" [beehiiv: Evaluating AI Agent Tool Selection].

Empirically, the author found that when tools are listed in an agent prompt, LLMs disproportionately pick tools appearing earlier in the list. For example, the first tool index was chosen 9.51% more often than it was actually the correct choice, while later tools were under-selected [beehiiv: Evaluating AI Agent Tool Selection]. Importantly, this was not limited to smaller open-source models — even ""'gold standard' OpenAI LLMs fall victim to positional biases"" [beehiiv: Evaluating AI Agent Tool Selection].

The broader takeaway from the post is that evaluating agents requires going beyond final-answer correctness: you must specifically measure whether the agent picks the right tool at the right time, because an agent can arrive at a correct answer even after selecting wrong tools along the way [beehiiv: Evaluating AI Agent Tool Selection].

## Connection to Supervised Learning Evaluation (Wikipedia)

The connection here is partly explicit and partly inferential — I'll flag which is which.

**Explicitly supported by the evidence:**

- Supervised learning trains a model on paired inputs and desired outputs, with the goal of producing a function that predicts outputs for new inputs; evaluation is framed around whether the model produces the correct output [wikipedia: Machine learning] [wikipedia: Neural network (machine learning)].
- Wikipedia emphasizes that model assessment relies on techniques like holdout splits, K-fold cross-validation, and bootstrap to estimate accuracy on held-out data [wikipedia: Machine learning]. This parallels the AI Office Hours post's call for ""robust testing frameworks"" that measure tool-selection accuracy against known-correct tools rather than trusting the final output [beehiiv: Evaluating AI Agent Tool Selection].
- Wikipedia also notes that ""trained models derived from biased or non-evaluated data can result in skewed or undesired predictions,"" and that algorithmic bias can arise from data preparation issues [wikipedia: Machine learning]. The tool-selection post documents a concrete instance of such skew: systematically over-picking earlier-indexed tools [beehiiv: Evaluating AI Agent Tool Selection].
- For GPT-style models specifically, Wikipedia says evaluation increasingly incorporates ""robustness, bias, and toxicity"" alongside raw accuracy [wikipedia: Generative pre-trained transformer]. Positional bias in tool selection fits naturally into this expanded notion of evaluation.

**The broader link:** Both framings share a core principle — you cannot evaluate a learned system only by whether its final output happens to be correct. Supervised learning evaluation uses structured procedures (train/test splits, cross-validation) to probe generalization and detect bias [wikipedia: Machine learning], and the AI Office Hours post applies an analogous discipline to agents: instrumenting tool choices across many trials to detect a systematic positional bias that raw end-to-end accuracy would hide [beehiiv: Evaluating AI Agent Tool Selection].

## Caveats

- The evidence does **not** show that the AI Office Hours post itself frames its methodology in supervised-learning terminology, nor does it cite Wikipedia's evaluation concepts. The connection between the two is a thematic parallel I'm drawing from the supplied sources, not a claim made in the post.
- Wikipedia's supplied excerpts discuss supervised learning evaluation in general (accuracy estimation, cross-validation, bias from data) but do not discuss positional bias or LLM tool selection specifically.",106.4043710231781,0,0,0.0,4,0,,5.0,4.0,4.0,3.0,4.0,"The answer accurately describes positional bias per the beehiiv post and grounds every claim in the evidence chunks, even explicitly flagging where it is drawing inferential parallels vs. citing sources. It covers the key facts (lost-in-the-middle, 9.51% over-selection, OpenAI models affected, need for robust testing). The connection to supervised evaluation is drawn from holdout/cross-validation and bias chunks rather than information retrieval metrics (the reference mentions IR), but this is a reasonable substitution given the evidence. Somewhat verbose with headers and caveats, costing conciseness points, but the caveats actually improve faithfulness.","The Beehiiv post argues that LLM agents are biased toward tools listed earlier in the prompt, so accuracy on tool-selection benchmarks is sensitive to ordering. Wikipedia's articles on machine learning and information retrieval describe how supervised evaluation depends on a held-out test set and on metrics that are robust to spurious correlations; positional bias is exactly such a spurious correlation.",hard,2
workflow,anthropic/claude-opus-4.7,,0,Compare what the AI Office Hours '(Re-) Ranking RAG Solutions' post recommends to how Wikipedia describes BM25 and cross-encoders as information retrieval techniques.,"# Comparing AI Office Hours' Re-Ranking Recommendations with Wikipedia on BM25 and Cross-Encoders

## What the AI Office Hours Post Recommends

The ""(Re-) Ranking RAG Solutions"" post by Sinan Ozdemir identifies a core limitation of standard RAG pipelines: ""Cosine similarity between embeddings can only go so far in terms of matching queries to documents"" [beehiiv: (Re-) Ranking RAG Solutions]. To address this, the post recommends adding a **re-ranking step** after initial vector retrieval, which can be implemented in ""just 5-10 more lines of code"" to ""re-sort those documents from Pinecone to try and surface the actual relevant document to the top of the list"" [beehiiv: (Re-) Ranking RAG Solutions].

The practical benefit, per the post, is that consistently surfacing the correct document at the top lets developers ""pass fewer documents to our final RAG generation prompt resulting in a tighter, faster, and cheaper integration"" [beehiiv: (Re-) Ranking RAG Solutions]. The post specifically benchmarks **Pongo and Cohere** as re-ranker providers, noting ""Pongo beat Cohere on English examples"" and that both ""made our retrieval rankings better with ~5 lines of added code"" [beehiiv: (Re-) Ranking RAG Solutions].

## How Wikipedia Describes BM25

Wikipedia describes **Okapi BM25** as ""a ranking function used by search engines to estimate the relevance of documents to a given search query,"" based on ""the probabilistic retrieval framework developed in the 1970s and 1980s by Stephen E. Robertson, Karen Spärck Jones, and others"" [wikipedia: Okapi BM25]. It is a ""TF-IDF-like retrieval function"" [wikipedia: Okapi BM25] and operates as ""a bag-of-words retrieval function that ranks a set of documents based on the query terms appearing in each document, regardless of their proximity within the document"" [wikipedia: Okapi BM25].

## How Wikipedia Describes Cross-Encoders

**The supplied evidence does not contain a Wikipedia description of cross-encoders.** I cannot directly compare the AI Office Hours post to Wikipedia's characterization of cross-encoders from this evidence set. Wikipedia's Retrieval-augmented generation article does mention that ""Reranking techniques can refine retriever performance by prioritizing the most relevant retrieved documents during training"" [wikipedia: Retrieval-augmented generation], but it does not specifically describe cross-encoders as a technique.

## Comparison

| Aspect | AI Office Hours Post | Wikipedia (BM25) |
|---|---|---|
| **Role** | Re-ranker applied *after* vector retrieval to reorder candidates [beehiiv: (Re-) Ranking RAG Solutions] | A first-stage ranking function itself, estimating document relevance to a query [wikipedia: Okapi BM25] |
| **Underlying signal** | Contrasts itself against ""cosine similarity between embeddings"" [beehiiv: (Re-) Ranking RAG Solutions]; does not specify the re-ranker mechanism in the provided excerpts | Probabilistic, TF-IDF-like, bag-of-words lexical matching [wikipedia: Okapi BM25] |
| **Era/origin** | Modern commercial APIs (Pongo, Cohere) [beehiiv: (Re-) Ranking RAG Solutions] | Rooted in 1970s–80s probabilistic retrieval research [wikipedia: Okapi BM25] |
| **Granularity** | Word-order/proximity not discussed in excerpts | Explicitly ""regardless of their proximity within the document"" [wikipedia: Okapi BM25] |

The two sources address **different layers of the retrieval stack**: Wikipedia's BM25 article describes a classical lexical ranking function used as a primary retrieval method [wikipedia: Okapi BM25], while the AI Office Hours post focuses on **post-retrieval re-ranking** as an add-on to embedding-based retrieval in a RAG pipeline [beehiiv: (Re-) Ranking RAG Solutions]. This is consistent with Wikipedia's general note that ""Reranking techniques can refine retriever performance by prioritizing the most relevant retrieved documents"" [wikipedia: Retrieval-augmented generation].

## Caveats

- The provided evidence **does not include a Wikipedia entry on cross-encoders**, so any direct comparison on that specific technique is unsupported by the given sources.
- The AI Office Hours excerpts **do not explicitly state that the Pongo/Cohere re-rankers are cross-encoders** or describe their internal architecture, so mapping the post's recommendation onto the cross-encoder concept cannot be done from this evidence alone.
- Similarly, the post does not mention BM25; the comparison above is structural (lexical first-stage ranking vs. neural re-ranking) rather than drawn from a direct juxtaposition in the sources.",176.70248103141785,0,0,0.0,7,0,,4.0,3.0,4.0,3.0,3.6,"The candidate accurately describes the Beehiiv post's re-ranking recommendation and Wikipedia's BM25 description, with good grounding in evidence. It honestly admits the evidence lacks a Wikipedia cross-encoder entry — which is faithful behavior. However, it misses that the post does mention cross-encoders (""re-rankers' architectures (often cross-encoders)""), which is in the evidence and should have been used. The reference answer's key insight — BM25 as cheap first-pass + cross-encoder for precision as a two-stage pipeline — is only partially conveyed. Somewhat verbose with tables and caveats, reducing conciseness.","The Beehiiv post advocates a two-stage pipeline: cheap first-pass retrieval (dense or sparse) followed by a cross-encoder reranker on the top candidates. Wikipedia describes BM25 as a probabilistic sparse retrieval ranking function based on term frequency and document length, and cross-encoders as bi-text models that score (query, document) pairs jointly with attention. The post's recipe layers these: BM25 for cheap recall, cross-encoder for precision.",hard,2
