variant,model,query_id,run_idx,question,answer,latency_s,input_tokens,output_tokens,cost_usd,n_retrievals,n_tool_calls,error,faithfulness,completeness,correctness,conciseness,overall,judge_notes,reference_answer,difficulty,hop_count
workflow,anthropic/claude-opus-4.7,,0,Connect the 'AIs supervising AIs' post to the Wikipedia entry on RLHF: what is the underlying technique and why does it matter?,"# Connecting ""AIs Supervising AIs"" to RLHF

## The Underlying Technique

The ""AIs Supervising AIs"" post by Sinan Ozdemir explores **scale supervision**—""an AI's ability to judge another AI on the generated responses"" [beehiiv: AIs Supervising AIs]. The notebook referenced in the post is explicitly titled `rlaif.ipynb` (RLAIF — Reinforcement Learning from AI Feedback), positioning it as a variant of the more established RLHF pipeline [beehiiv: AIs Supervising AIs].

RLHF, per Wikipedia, ""is a technique to align an intelligent agent with human preferences. It involves training a reward model to represent preferences, which can then be used to train other models through reinforcement learning"" [wikipedia: Reinforcement learning from human feedback]. In other words, humans produce comparison/preference data, that data trains a reward model, and the reward model guides RL fine-tuning of the target model [wikipedia: Reinforcement learning].

The connection: the beehiiv post investigates whether an **AI can stand in for the human labeler** in that comparison step. Ozdemir notes he uses ""comparison data"" and tests how well models like GPT-4 can label preferences off the shelf [beehiiv: AIs Supervising AIs]. This is the same kind of preference/comparison data that normally feeds an RLHF reward model [wikipedia: Reinforcement learning from human feedback]. Anthropic's Constitutional AI is a related instance of this idea, where ""the AI system evaluates the generated output and then adjusts the AI models to better fit the constitution"" [wikipedia: Anthropic].

## Why It Matters

**1. RLHF is the backbone of modern aligned LLMs.** It was ""a major breakthrough"" used in InstructGPT and ChatGPT to align models with ""human judgments on complex and subjective tasks"" [wikipedia: Reinforcement learning]. So any technique that touches the preference-labeling step directly affects how today's assistants are trained.

**2. Human feedback is the bottleneck.** Wikipedia notes that ""collecting data for RLHF is less scalable and more expensive"" than unsupervised alternatives, and ""its quality and consistency may vary depending on the task, interface, and the preferences and biases of individual humans"" [wikipedia: Reinforcement learning from human feedback]. If AIs can reliably supervise other AIs, the preference-data pipeline becomes dramatically cheaper and more scalable — which is precisely the motivation behind Ozdemir's experiments [beehiiv: AIs Supervising AIs].

**3. But quality and bias risks carry over (and may worsen).** RLHF's effectiveness ""depends on the quality of human feedback""; biased or inconsistent feedback leads to biased models and overfitting to a reward signal [wikipedia: Reinforcement learning from human feedback]. Ozdemir's practical recommendations reflect this: use few-shot examples of preferred answers, expand criteria in the system prompt, and ""have a human double check at least a few responses to get a sense of how well the AI is doing"" [beehiiv: AIs Supervising AIs]. In other words, AI supervision doesn't remove the need for human oversight — it reshapes where humans intervene.

## Caveat on Unsupported Links

The evidence provided does **not** include explicit commentary in the beehiiv post linking its experiments to RLHF by name, nor does it include the quantitative results of Ozdemir's replication of the HuggingFace ""Can foundation models label data like humans"" study [beehiiv: AIs Supervising AIs]. The RLHF connection here is inferred from (a) the notebook filename `rlaif.ipynb` and (b) the use of comparison/preference data — the same input format RLHF reward models consume [beehiiv: AIs Supervising AIs][wikipedia: Reinforcement learning from human feedback].",112.96706199645996,0,0,0.0,5,0,,5.0,5.0,5.0,3.0,4.5,"The answer correctly connects the beehiiv post's ""scale supervision"" concept to RLHF/RLAIF, grounds every claim in specific cited evidence chunks, and covers reward model training, RL optimization, and the RLAIF substitution of AI for human labelers (matching the reference). It also adds relevant context (bottleneck, bias risks) with citations. Slightly verbose with section headers and a caveat section, lowering conciseness, but faithfulness is strong and the honest acknowledgment about inferred links is a plus. Missed mentioning PPO specifically, though DPO is referenced implicitly via the evidence.",Both describe using one model to provide feedback that trains another. The Beehiiv post focuses on practical 'AI feedback' loops where a model grades another model's outputs. Wikipedia's RLHF article formalizes this as training a reward model on human (or AI) preferences and then optimizing a policy against that reward via PPO or DPO. RLAIF (RL from AI feedback) is the specific term for replacing human labelers with an AI grader.,hard,3
workflow,anthropic/claude-opus-4.7,,0,Connect the 'AIs supervising AIs' post to the Wikipedia entry on RLHF: what is the underlying technique and why does it matter?,"# Connecting ""AIs Supervising AIs"" to RLHF

## The Underlying Technique

The beehiiv post ""AIs Supervising AIs"" discusses **scale supervision** — described as ""an AI's ability to judge another AI on the generated responses"" — inspired by a HuggingFace post titled ""Can foundation models label data like humans"" [beehiiv: AIs Supervising AIs]. The post uses comparison data to explore whether AIs can replicate the judging role typically performed by humans [beehiiv: AIs Supervising AIs].

This connects directly to **Reinforcement Learning from Human Feedback (RLHF)**, the dominant alignment technique for modern LLMs. In RLHF:

- A **reward model** is trained in a supervised manner to predict whether a response to a prompt is good (high reward) or bad (low reward), based on **ranking data collected from human annotators** [wikipedia: Reinforcement learning from human feedback].
- That reward model then serves as the reward function used to optimize the agent's policy via an algorithm like proximal policy optimization (PPO) [wikipedia: Reinforcement learning from human feedback].
- RLHF was popularized through OpenAI's work on InstructGPT and later ChatGPT, enabling models to align behavior with human judgments on complex and subjective tasks [wikipedia: Reinforcement learning].

The link between the two: the ""comparison data"" Ozdemir mentions [beehiiv: AIs Supervising AIs] is exactly the kind of pairwise ranking data that RLHF's reward model is trained on [wikipedia: Reinforcement learning from human feedback]. ""AIs supervising AIs"" essentially asks whether an AI judge can stand in for the **human annotator** step of RLHF.

## Why It Matters

RLHF has well-documented scalability problems. According to Wikipedia:

> ""Compared to data collection for techniques like unsupervised or self-supervised learning, collecting data for RLHF is less scalable and more expensive. Its quality and consistency may vary depending on the task, interface, and the preferences and biases of individual humans."" [wikipedia: Reinforcement learning from human feedback]

This is precisely the bottleneck that ""scale supervision"" targets. If a foundation model can reliably label preference data the way humans do, then:

1. **Scalability**: AI labelers can produce vastly more comparison data than human annotators, addressing RLHF's core cost/scale limitation [wikipedia: Reinforcement learning from human feedback].
2. **Consistency**: AI judges may reduce the variability introduced by individual human biases noted as a limitation of RLHF [wikipedia: Reinforcement learning from human feedback].
3. **Alignment pipeline acceleration**: Since RLHF is the technique behind InstructGPT and ChatGPT [wikipedia: Reinforcement learning], improving its data pipeline has direct downstream effects on how quickly and cheaply aligned LLMs can be trained.

## Caveats

The beehiiv evidence provided is brief — it establishes the motivation (replicating HuggingFace results on AI-as-judge) and the data source, but the supplied excerpts do not include Ozdemir's actual findings or methodology details [beehiiv: AIs Supervising AIs]. So while the conceptual bridge to RLHF is clear, I cannot report from the evidence whether his experiments concluded AI supervisors are adequate substitutes for human labelers.",116.55250811576843,0,0,0.0,5,0,,5.0,4.0,4.0,3.0,4.0,"The candidate answer accurately connects the beehiiv post's 'scale supervision' concept to RLHF's reward-model training pipeline, correctly describing the reward model, PPO optimization, and human annotator ranking data—all directly supported by the evidence chunks. It explains why AI-as-judge matters by citing RLHF's scalability limitations from the evidence. One minor gap: it does not explicitly name RLAIF, though the RLAIF evidence chunk was available and the reference answer highlights this term. DPO is not mentioned but also not in evidence. The answer is well-grounded with inline citations, slightly verbose with headers and caveats but stays on-topic. Faithfulness is strong—claims map to evidence.",Both describe using one model to provide feedback that trains another. The Beehiiv post focuses on practical 'AI feedback' loops where a model grades another model's outputs. Wikipedia's RLHF article formalizes this as training a reward model on human (or AI) preferences and then optimizing a policy against that reward via PPO or DPO. RLAIF (RL from AI feedback) is the specific term for replacing human labelers with an AI grader.,hard,3
workflow,anthropic/claude-opus-4.7,,0,"According to Wikipedia, what role did Geoffrey Hinton play in the deep learning revival, and how does the 'Probing LLMs for a World Model' Beehiiv post connect to that intellectual lineage?","# Geoffrey Hinton's Role in the Deep Learning Revival

According to Wikipedia, Geoffrey Hinton played several foundational roles in reviving and advancing deep learning:

1. **Reviving connectionism**: Hinton was central to ""the revival of 'connectionism', including neural network research"" [wikipedia: Artificial intelligence].

2. **Backpropagation**: With David Rumelhart and Ronald J. Williams, Hinton co-authored a highly cited 1986 paper that popularized the backpropagation algorithm for training multi-layer neural networks, showing such networks ""can learn useful internal representations of data"" [wikipedia: Geoffrey Hinton].

3. **Boltzmann machines**: Hinton proved that a device called a ""Boltzmann machine"" could learn and process information, a result that helped revive exploration of artificial neural networks [wikipedia: History of artificial intelligence].

4. **AlexNet and the 2012 breakthrough**: With his students Alex Krizhevsky and Ilya Sutskever, Hinton designed AlexNet, whose performance on the ImageNet challenge 2012 was ""a breakthrough in the field of computer vision"" [wikipedia: Geoffrey Hinton].

5. **Recognition**: He is regarded as a ""leading figure in the deep learning community"" [wikipedia: Geoffrey Hinton], shared the 2018 Turing Award with Bengio and LeCun as a ""Godfather of Deep Learning"" [wikipedia: Geoffrey Hinton][wikipedia: Yann LeCun], and received the 2024 Nobel Prize in Physics with John Hopfield for ""foundational discoveries and inventions that enable machine learning with artificial neural networks"" [wikipedia: Geoffrey Hinton].

# Connection to the 'Probing LLMs for a World Model' Post

The Beehiiv post engages with an active debate over ""whether LLMs are just memorizing vast amounts of statistics or if they can learn a more cohesive representation of the world whose language they model"" [beehiiv: Probing LLMs for a World Model]. It probes internal layer representations of models like Llama 2, Llama 3, Mistral, and BERT by regressing from token embeddings to target values (e.g., birth/death years, GSM8K answers) [beehiiv: Probing LLMs for a World Model].

The intellectual lineage connects to Hinton in the following supported ways:

- **Learned internal representations**: The post's core methodology — analyzing what neural networks encode in their hidden layers — is a direct descendant of the finding from Rumelhart, Hinton, and Williams that multi-layer networks trained via backpropagation ""can learn useful internal representations of data"" [wikipedia: Geoffrey Hinton]. Probing hidden-layer embeddings is essentially an empirical test of what those internal representations contain.

- **Deep neural architectures as the substrate**: The LLMs probed in the post (Llama, Mistral, BERT) are built on the deep neural network paradigm whose viability Hinton helped establish through backpropagation, Boltzmann machines, and the AlexNet breakthrough [wikipedia: Geoffrey Hinton][wikipedia: History of artificial intelligence]. Wikipedia explicitly notes that language-model architectures followed ""the breakthrough of deep neural networks in image classification around 2012"" [wikipedia: Large language model] — i.e., the AlexNet moment Hinton co-led.

- **Hinton's direct lineage to LLMs**: Ilya Sutskever, Hinton's AlexNet co-creator, went on to make ""major contributions to the field of deep learning, including sequence-to-sequence learning... GPT models"" [wikipedia: Ilya Sutskever], tying Hinton's students directly to the LLM family the post probes.

**Unsupported / not stated**: The Beehiiv post itself does not mention Hinton, backpropagation, or explicitly frame itself within Hinton's lineage — the connection above is inferred from the Wikipedia evidence about the architectures and training methods the probed models rely on, not stated in the post.",114.6519889831543,0,0,0.0,4,0,,5.0,5.0,5.0,3.0,4.6,"The answer thoroughly covers Hinton's roles (backpropagation, Boltzmann machines, AlexNet, connectionism revival) with accurate citations to the evidence. It connects the Beehiiv post to Hinton's lineage via internal representations (directly citing Rumelhart/Hinton/Williams) and the AlexNet-to-LLM pipeline through Sutskever. Every factual claim is grounded in the provided chunks, and the answer commendably flags what is NOT stated in the post. Slightly verbose with numbered lists and extensive quoting, but otherwise well-structured and faithful.","Wikipedia describes Hinton as a key figure in the 1980s revival of backpropagation and the 2012 AlexNet breakthrough that started the deep learning era. The Beehiiv post probes whether LLMs have learned implicit world models, which extends Hinton's long-running argument that distributed neural representations encode meaningful structure. The lineage runs from early connectionist representations to today's question of whether scaled transformers internalize world models.",hard,2
workflow,anthropic/claude-opus-4.7,,0,"According to Wikipedia, what role did Geoffrey Hinton play in the deep learning revival, and how does the 'Probing LLMs for a World Model' Beehiiv post connect to that intellectual lineage?","# Geoffrey Hinton and the Deep Learning Revival

## Hinton's Role According to Wikipedia

Geoffrey Hinton played a foundational role in reviving neural network research and ushering in the deep learning era. Wikipedia identifies several key contributions:

- **Reviving connectionism**: Wikipedia credits Hinton directly with leading ""the revival of 'connectionism,' including neural network research"" [wikipedia: Artificial intelligence].
- **Popularizing backpropagation**: With David Rumelhart and Ronald J. Williams, Hinton co-authored a highly cited 1986 paper that popularized backpropagation for training multi-layer neural networks, showing such networks ""can learn useful internal representations of data"" [wikipedia: Geoffrey Hinton].
- **Foundational architectures**: He co-invented Boltzmann machines (1985) and contributed distributed representations, mixtures of experts, Helmholtz machines, and the wake-sleep algorithm [wikipedia: Geoffrey Hinton].
- **The AlexNet breakthrough**: In 2012, Hinton—working with students Alex Krizhevsky and Ilya Sutskever—produced AlexNet, which won the ImageNet competition ""by a significant margin over shallow machine learning methods,"" a turning point after which ""dozens of other approaches to image recognition were abandoned in favor of deep learning"" [wikipedia: Geoffrey Hinton][wikipedia: Deep learning][wikipedia: History of artificial intelligence].
- **Recognition**: He shared the 2018 Turing Award with Bengio and LeCun (the ""Godfathers of Deep Learning"") and the 2024 Nobel Prize in Physics with John Hopfield for ""foundational discoveries and inventions that enable machine learning with artificial neural networks"" [wikipedia: Geoffrey Hinton].

## Connection to ""Probing LLMs for a World Model""

The Beehiiv post by Sinan Ozdemir extends this intellectual lineage in several concrete ways:

1. **Built on Hinton-lineage architectures**: The post probes BERT, Llama 2 (7B and 13B), Llama 3, and Mistral models [beehiiv: Probing LLMs for a World Model]. These are all deep neural networks whose training fundamentally depends on the backpropagation-based multi-layer learning Hinton helped popularize [wikipedia: Geoffrey Hinton].

2. **Studying ""internal representations""**: Hinton's 1986 work with Rumelhart and Williams specifically showed that multi-layer networks ""can learn useful internal representations of data"" [wikipedia: Geoffrey Hinton]. The Beehiiv post pursues exactly this question at a modern scale, asking whether LLMs are ""just memorizing vast amounts of statistics or if they can learn a more cohesive representation of the world,"" and citing research showing ""LLMs can learn linear representations of space and time"" [beehiiv: Probing LLMs for a World Model].

3. **Methodology of extracting hidden states**: The post grabs ""embeddings from the middle layer and the final layer of our LLM's hidden states"" and regresses on them to probe encoded knowledge [beehiiv: Probing LLMs for a World Model]. This is methodologically a descendant of the representation-learning tradition Hinton championed.

4. **Uses Hinton-era tooling implicitly**: BERT and autoregressive Llama/Mistral architectures are transformer networks trained via backpropagation on GPUs—both the learning algorithm and the deep-network paradigm trace to Hinton's contributions [wikipedia: Geoffrey Hinton][wikipedia: Neural network (machine learning)].

**Caveat on unsupported claims**: The Beehiiv post itself does not explicitly name Hinton or reference the deep learning revival; the connection above is drawn by juxtaposing the two evidence sets. Any direct citation from Ozdemir to Hinton's work is not present in the supplied evidence.",120.09092211723328,0,0,0.0,4,0,,5.0,5.0,5.0,3.0,4.5,"The answer accurately captures Hinton's role in reviving connectionism, popularizing backpropagation, and the AlexNet breakthrough, all grounded in the provided evidence with proper citations. It thoughtfully connects the Beehiiv post's probing of internal representations to Hinton's 1986 finding that networks ""learn useful internal representations,"" directly echoing the reference's lineage argument. The explicit caveat that the Beehiiv post doesn't name Hinton is a strong faithfulness signal. Slightly verbose with bullet-heavy structure and some repetition, costing conciseness points, but correctness and completeness are excellent.","Wikipedia describes Hinton as a key figure in the 1980s revival of backpropagation and the 2012 AlexNet breakthrough that started the deep learning era. The Beehiiv post probes whether LLMs have learned implicit world models, which extends Hinton's long-running argument that distributed neural representations encode meaningful structure. The lineage runs from early connectionist representations to today's question of whether scaled transformers internalize world models.",hard,2
workflow,anthropic/claude-opus-4.7,,0,"According to Wikipedia, what role did Geoffrey Hinton play in the deep learning revival, and how does the 'Probing LLMs for a World Model' Beehiiv post connect to that intellectual lineage?","# Geoffrey Hinton's Role in the Deep Learning Revival

According to Wikipedia, Geoffrey Hinton played several foundational roles in reviving deep learning:

1. **Backpropagation**: With David Rumelhart and Ronald J. Williams, Hinton co-authored a highly cited 1986 paper that popularized the backpropagation algorithm for training multi-layer neural networks, whose experiments showed that such networks ""can learn useful internal representations of data"" [wikipedia: Geoffrey Hinton].

2. **AlexNet and the 2012 ImageNet breakthrough**: Hinton, with his students Alex Krizhevsky and Ilya Sutskever, designed AlexNet, which won the ImageNet Large Scale Visual Recognition Challenge in 2012 with a top-5 error rate of 15.3% — more than 10.8 points above the runner-up [wikipedia: AlexNet]. This victory ""over shallow machine learning methods"" is identified as the moment that, combined with GPU computing, gave rise to what ""became known as 'deep learning'"" [wikipedia: Neural network (machine learning)]. Notably, in 2011 Hinton was actively evangelizing neural networks, asking colleagues ""What do I have to do to convince you that neural networks are the future?"" [wikipedia: AlexNet].

3. **Recognition as a ""Godfather of Deep Learning""**: Hinton shared the 2018 Turing Award with Yoshua Bengio and Yann LeCun for deep learning work, and the trio are called the ""Godfathers of Deep Learning"" [wikipedia: Geoffrey Hinton][wikipedia: Yann LeCun]. He later shared the 2024 Nobel Prize in Physics with John Hopfield for ""foundational discoveries and inventions that enable machine learning with artificial neural networks"" [wikipedia: Geoffrey Hinton].

# Connection to ""Probing LLMs for a World Model""

The Beehiiv post by Sinan Ozdemir engages a debate about ""whether LLMs are just memorizing vast amounts of statistics or if they can learn a more cohesive representation of the world whose language they model"" [beehiiv: Probing LLMs for a World Model]. Methodologically, it probes internal embeddings — the middle and final hidden-layer representations of models like Llama 2 (7B and 13B), BERT, and Mistral — by regressing them against attributes such as birth year and death year to test whether these networks encode structured world knowledge [beehiiv: Probing LLMs for a World Model].

The intellectual lineage connects to Hinton's work in a few concrete ways supported by the evidence:

- **Learned internal representations**: The very premise of probing — that meaningful structure lives in hidden-layer activations — traces to the Rumelhart/Hinton/Williams demonstration that backpropagation-trained multi-layer networks ""can learn useful internal representations of data"" [wikipedia: Geoffrey Hinton].
- **The deep learning paradigm itself**: The Llama, Mistral, and BERT models probed in the post are deep neural networks, a paradigm whose modern dominance Wikipedia attributes to the AlexNet breakthrough led by Hinton and his students [wikipedia: AlexNet][wikipedia: Neural network (machine learning)].
- **Direct student lineage**: Ilya Sutskever, Hinton's AlexNet collaborator, went on to make ""major contributions to the field of deep learning, including sequence-to-sequence learning... and GPT models"" [wikipedia: Ilya Sutskever] — the architectural family underlying the LLMs being probed.

**Unsupported/not stated**: The Beehiiv post itself does not mention Hinton, backpropagation, or AlexNet by name in the provided excerpts, so the connection above is inferred from the shared technical substrate (deep neural networks and learned internal representations) rather than from explicit citation within the post.",94.65901303291321,0,0,0.0,4,0,"
JUDGE_ERR: Structured output failed after 2 attempts for schema RubricResult: Your previous response failed schema validation with this error:
6 validation errors for RubricResult
faithfulness
  Field required [type=missing, input_value={}, input_type=dict]
    For further information visit https://errors.pydantic.dev/2.13/v/missing
completeness
  Field required [type=missing, input_value={}, input_type=dict]
    For further information visit https://errors.pydantic.dev/2.13/v/missing
correctness
  Field required [type=missing, input_value={}, input_type=dict]
    For further information visit https://errors.pydantic.dev/2.13/v/missing
conciseness
  Field required [type=missing, input_value={}, input_type=dict]
    For further information visit https://errors.pydantic.dev/2.13/v/missing
overall
  Field required [type=missing, input_value={}, input_type=dict]
    For further information visit https://errors.pydantic.dev/2.13/v/missing
notes
  Field required [type=missing, input_value={}, input_type=dict]
    For further information visit https://errors.pydantic.dev/2.13/v/missing

Re-emit a response that conforms to the RubricResult schema. Pay attention to required fields and types.",,,,,,,"Wikipedia describes Hinton as a key figure in the 1980s revival of backpropagation and the 2012 AlexNet breakthrough that started the deep learning era. The Beehiiv post probes whether LLMs have learned implicit world models, which extends Hinton's long-running argument that distributed neural representations encode meaningful structure. The lineage runs from early connectionist representations to today's question of whether scaled transformers internalize world models.",hard,2
